{
  "schema": "fun.lazying.media.catalog.v1",
  "version": 1,
  "site": {
    "name": "Fun Lazying Art",
    "url": "https://fun.lazying.art",
    "protocol": "fun.lazying.media.v1"
  },
  "defaultMedia": "yun-hai-zhi-lian-haifeng-duange",
  "items": [
    {
      "id": "one-sky-three-lights-mixed",
      "kind": "song",
      "title": "One Sky, Three Lights",
      "artist": "Musia",
      "summary": "A bright multilingual song about shared light, with synced lyrics, translations, and chord timing.",
      "manifest": "data/songs/one-sky-three-lights-mixed/manifest.json",
      "cover": "assets/covers/one-sky-three-lights-16x9.png",
      "languages": [
        "mul",
        "en",
        "zh-Hans",
        "ja",
        "yue-Hant"
      ],
      "tags": [
        "music",
        "multilingual",
        "shared-sky",
        "lyrics",
        "chords",
        "Cantonese"
      ]
    },
    {
      "id": "xia-ke-xing-original-poem",
      "kind": "song",
      "title": "侠客行 · 原诗版",
      "artist": "Musia",
      "manifest": "data/songs/xia-ke-xing-original-poem/manifest.json",
      "cover": "assets/covers/xia-ke-xing-original-poem-16x9.png",
      "tags": [
        "song",
        "li-bai",
        "tang-poetry",
        "wuxia",
        "ace",
        "original-poem",
        "rerun"
      ],
      "languages": [
        "zh-Hans",
        "en",
        "ja"
      ]
    },
    {
      "id": "yun-hai-zhi-lian-haifeng-duange",
      "kind": "song",
      "title": "云海之恋",
      "artist": "Musia",
      "summary": "The standard ACE-Step Mandarin cloud-sea love ballad with ASR-corrected trilingual lyrics, pinyin, furigana, and chord timing.",
      "manifest": "data/songs/yun-hai-zhi-lian-haifeng-duange/manifest.json",
      "cover": "assets/covers/yun-hai-zhi-lian-haifeng-duange-16x9.png",
      "languages": [
        "zh-Hans",
        "en",
        "ja"
      ],
      "tags": [
        "music",
        "love",
        "cloud-sea",
        "Mandarin",
        "ACE-Step",
        "standard",
        "pinyin",
        "furigana"
      ]
    },
    {
      "id": "xia-ke-xing",
      "kind": "song",
      "title": "侠客行",
      "artist": "Musia",
      "summary": "An ACE-Step Mandarin wuxia theme adapted from Li Bai's public-domain poem, with ASR-corrected trilingual lyrics, pinyin, furigana, and chord timing.",
      "manifest": "data/songs/xia-ke-xing/manifest.json",
      "cover": "assets/covers/xia-ke-xing-16x9.png",
      "languages": [
        "zh-Hans",
        "en",
        "ja"
      ],
      "tags": [
        "music",
        "wuxia",
        "Li Bai",
        "Mandarin",
        "ACE-Step",
        "poetry",
        "pinyin",
        "furigana"
      ]
    },
    {
      "id": "meng-you-tian-mu-original-poem",
      "kind": "song",
      "title": "梦游天姥吟留别 · 原诗版",
      "artist": "Musia",
      "summary": "A long-form ACE-Step Mandarin original-poem version of Li Bai's 梦游天姥吟留别, with ASR-corrected trilingual lyrics, pinyin, furigana, and chord timing.",
      "manifest": "data/songs/meng-you-tian-mu-original-poem/manifest.json",
      "cover": "assets/covers/meng-you-tian-mu-16x9.png",
      "languages": [
        "zh-Hans",
        "en",
        "ja"
      ],
      "tags": [
        "music",
        "Li Bai",
        "Tang poetry",
        "Mandarin",
        "ACE-Step",
        "original-poem",
        "xianxia",
        "pinyin",
        "furigana"
      ]
    },
    {
      "id": "meng-you-tian-mu",
      "kind": "song",
      "title": "梦游天姥",
      "artist": "Musia",
      "summary": "A cinematic ACE-Step Mandarin normal-song adaptation of Li Bai's dream journey to Mount Tianmu, with corrected trilingual lyrics, pinyin, furigana, and chord timing.",
      "manifest": "data/songs/meng-you-tian-mu/manifest.json",
      "cover": "assets/covers/meng-you-tian-mu-16x9.png",
      "languages": [
        "zh-Hans",
        "en",
        "ja"
      ],
      "tags": [
        "music",
        "Li Bai",
        "Tang poetry",
        "Mandarin",
        "ACE-Step",
        "xianxia",
        "pinyin",
        "furigana"
      ]
    },
    {
      "id": "qiang-jin-jiu-normal-song",
      "kind": "song",
      "title": "将进酒",
      "artist": "Musia",
      "summary": "The normal-song ACE-Step Mandarin adaptation of Li Bai's 将进酒, with corrected trilingual lyrics, pinyin, furigana, and chord timing.",
      "manifest": "data/songs/qiang-jin-jiu-normal-song/manifest.json",
      "cover": "assets/covers/qiang-jin-jiu-normal-song-16x9.png",
      "languages": [
        "zh-Hans",
        "en",
        "ja"
      ],
      "tags": [
        "music",
        "Li Bai",
        "Tang poetry",
        "Mandarin",
        "ACE-Step",
        "normal-song",
        "pinyin",
        "furigana"
      ]
    },
    {
      "id": "qiang-jin-jiu-original-poem",
      "kind": "song",
      "title": "将进酒 · 原诗版",
      "artist": "Musia",
      "summary": "A new ACE-Step Mandarin original-poem version of Li Bai's 将进酒, with ASR-corrected trilingual lyrics, pinyin, furigana, and chord timing.",
      "manifest": "data/songs/qiang-jin-jiu-original-poem/manifest.json",
      "cover": "assets/covers/qiang-jin-jiu-16x9.png",
      "languages": [
        "zh-Hans",
        "en",
        "ja"
      ],
      "tags": [
        "music",
        "Li Bai",
        "Tang poetry",
        "Mandarin",
        "ACE-Step",
        "original-poem",
        "pinyin",
        "furigana"
      ]
    },
    {
      "id": "qiang-jin-jiu",
      "kind": "song",
      "title": "将进酒 · ACE Poetry Demo",
      "artist": "Musia",
      "summary": "A female Mandarin ACE-Step poetry-song from Li Bai's original 将进酒, with pinyin, furigana, translations, and chord timing.",
      "manifest": "data/songs/qiang-jin-jiu/manifest.json",
      "cover": "assets/covers/qiang-jin-jiu-16x9.png",
      "languages": [
        "zh-Hans",
        "en",
        "ja"
      ],
      "tags": [
        "music",
        "Li Bai",
        "Tang poetry",
        "Mandarin",
        "ACE-Step",
        "poetry-demo",
        "pinyin",
        "furigana"
      ]
    },
    {
      "id": "yun-hai-zhi-lian-dr-short",
      "kind": "song",
      "title": "云海之恋 · DR Short",
      "artist": "Musia",
      "summary": "A compact DiffRhythm Mandarin cloud-sea route with ASR-corrected trilingual lyrics and chord timing.",
      "manifest": "data/songs/yun-hai-zhi-lian-dr-short/manifest.json",
      "cover": "assets/covers/yun-hai-zhi-lian-16x9.png",
      "languages": [
        "zh-Hans",
        "en",
        "ja"
      ],
      "tags": [
        "music",
        "love",
        "cloud-sea",
        "Mandarin",
        "DiffRhythm",
        "DR",
        "short",
        "pinyin",
        "furigana"
      ]
    },
    {
      "id": "yun-hai-zhi-lian",
      "kind": "song",
      "title": "云海之恋 · DR Full Lyrics",
      "artist": "Musia",
      "summary": "A full-length DiffRhythm Mandarin cloud-sea route with corrected trilingual lyrics, pinyin, furigana, and chord timing.",
      "manifest": "data/songs/yun-hai-zhi-lian/manifest.json",
      "cover": "assets/covers/yun-hai-zhi-lian-16x9.png",
      "languages": [
        "zh-Hans",
        "en",
        "ja"
      ],
      "tags": [
        "music",
        "love",
        "cloud-sea",
        "Mandarin",
        "pinyin",
        "furigana",
        "DiffRhythm",
        "DR",
        "full-lyrics"
      ]
    },
    {
      "id": "yun-hai-zhi-lian-legacy",
      "kind": "song",
      "title": "云海之恋 · ACE Legacy",
      "artist": "Musia",
      "summary": "An earlier ACE-Step cloud-sea love ballad candidate preserved for comparison.",
      "manifest": "data/songs/yun-hai-zhi-lian-legacy/manifest.json",
      "cover": "assets/covers/yun-hai-zhi-lian-16x9.png",
      "languages": [
        "zh-Hans",
        "en",
        "ja"
      ],
      "tags": [
        "music",
        "love",
        "cloud-sea",
        "ACE-Step",
        "ACE Legacy",
        "legacy"
      ]
    },
    {
      "id": "xiao-xiao-zhu-trilingual",
      "kind": "song",
      "title": "你是一只猪",
      "artist": "Musia",
      "summary": "A cute, slightly whiny comfort song with Mandarin, English, and Japanese vocals, synced lyrics, pinyin, furigana, and chord timing.",
      "manifest": "data/songs/xiao-xiao-zhu-trilingual/manifest.json",
      "cover": "assets/covers/xiao-xiao-zhu-16x9.png",
      "languages": [
        "zh-Hans",
        "en",
        "ja"
      ],
      "tags": [
        "music",
        "cute",
        "comfort",
        "bedroom-pop",
        "Mandarin",
        "English",
        "Japanese",
        "pinyin",
        "furigana"
      ]
    },
    {
      "id": "aya-chan-hikari-ame",
      "kind": "song",
      "title": "Aya Chan Hikari Ame",
      "artist": "Musia",
      "summary": "A warm Aya Chan rain-of-light character song with Japanese, English, and Mandarin vocals, synced lyrics, pinyin, furigana, and chord timing.",
      "manifest": "data/songs/aya-chan-hikari-ame/manifest.json",
      "cover": "assets/covers/aya-chan-hikari-ame-16x9.png",
      "languages": [
        "ja",
        "en",
        "zh-Hans"
      ],
      "tags": [
        "music",
        "Aya Chan",
        "LALACHAN",
        "multilingual",
        "rain",
        "light",
        "pinyin",
        "furigana"
      ]
    },
    {
      "id": "aya-chan-hikari-ame-full-mv",
      "kind": "mv",
      "title": "Aya Chan Hikari Ame Full MV",
      "artist": "Musia",
      "summary": "A hopeful LALACHAN music video for Aya Chan Hikari Ame with synced Japanese lyrics, English and Chinese translations, furigana, pinyin, and chord timing.",
      "manifest": "data/songs/aya-chan-hikari-ame-full-mv/manifest.json",
      "cover": "assets/covers/aya-chan-hikari-ame-16x9.png",
      "languages": [
        "ja",
        "en",
        "zh-Hans"
      ],
      "tags": [
        "MV",
        "Musia",
        "LALACHAN",
        "LalaMV",
        "Aya Chan",
        "Hikari Ame",